Title	Abstract	Journal	Date of Publication	Authors	PMID
Circulating microRNAs and serum proteins in breast cancer patients: Diagnostic relevance and grade-specific expression patterns.	BACKGROUND: Breast cancer is a prominent contributor to female cancer-related mortality. Early detection and accurate diagnosis are essential for effective management. AIM: To evaluate the diagnostic relevance of a panel of circulating microRNAs (miRNAs) independently or in combination with other tumor biomarkers and evaluate their sensitivity and specificity in classifying breast cancer patients by grade. METHODS: In the present study, we analyzed the aberrant expression of miR-21, miR-221, miR-1246, miR-145, and miR-382, in addition to the tumor biomarkers cancer antigen 15-3 (CA15-3) and 8-hydroxy-2'-deoxyguanosine (8-OHdG) in breast cancer patients with varying grades. RESULTS: Our results revealed distinct expression patterns of these miRNAs between grade II and III patients. Specifically, miR-21, miR-221, and miR-1246 were significantly elevated, while miR-145 and miR-382 were downregulated. Elevated serum levels of CA15-3 and 8-OHdG were observed in breast cancer patients compared to healthy controls, with CA15-3 showing greater diagnostic efficacy in differentiating between grades. Our study revealed strong correlations among evaluated miRNAs, suggesting their interconnected roles in breast cancer progression. Receiver operating characteristic curve analysis demonstrated high diagnostic accuracy for all investigated miRNAs, with miR-21 and miR-1246 showing the highest diagnostic power for differentiating patients from healthy individuals and distinguishing breast cancer grades. Moreover, the combination of multiple miRNAs and conventional tumor biomarkers revealed enhanced diagnostic accuracy and sensitivity. CONCLUSION: These findings suggest that circulating miRNAs may play a significant role in distinguishing breast cancer patients based on tumor grade, with superior diagnostic performance over some tumor biomarkers, supporting the development of multi-analyte liquid biopsy approaches in the diagnostic process and personalized management of breast cancer patients.	World journal of experimental medicine	2025 Sep 20	['El-Toukhy SE', 'Nabih HK', 'Kamel MM', 'Elmasry H', 'El-Daly SM']	41523763
Relationship of diabetes mellitus with prognostic factors in breast cancer.	BACKGROUND: Hyperglycemia secondary to diabetes can lead to organ failure unless properly controlled, and it is associated with numerous health issues, particularly metabolic problems. Breast cancer is one of the most common malignancies in females worldwide and represents a major health concern due to its morbidity and mortality. The progression of the disease and the response to treatment depend on numerous variables, including both tumor biology and patient-related factors. Key prognostic indicators include age, tumor size, lymph node involvement, histological type, hormone receptor status, and expression of biomarkers such as HER2. AIM: To investigate the relationship between preoperative blood glucose levels and cancer prognostic factors in patients diagnosed with breast cancer. METHODS: In this study patients diagnosed with breast cancer were classified into two groups: Those with blood glucose levels < 125 mg/dL and those with levels > 125 mg/dL. Estrogen and progesterone receptor positivity, Ki-67 percentage, Cerb2 positivity, number of positive lymph nodes, and presence of lymphovascular invasion were examined histopathologically. RESULTS: The study included 246 patients with breast cancer: 196 were in the normal glucose group and 50 were in the elevated glucose group. In the normal glucose group, 68% of the tumors were left-sided and 32% were right-sided, while all tumors in the elevated glucose group were left-sided. This difference was statistically significant (P < 0.001). Tumor size, Ki-67, and the number of positive lymph nodes were not associated with blood glucose in patients with breast cancer (P > 0.05 for all). However, blood glucose was correlated with age in this population. Correlation analyses revealed that blood glucose was positively correlated with age (r = 0.23, P < 0.001). Additionally, Ki-67 was correlated with tumor size (r = 0.14, P = 0.03) and age (r = -0.18, P = 0.005). CONCLUSION: Our study highlighted the complex interplay between metabolic factors, such as fasting glucose levels, and breast cancer characteristics. Elevated glucose levels were associated with older age. The significant association between tumor laterality and glucose levels underscores the need for further investigation into the collective influence of metabolic and anatomical factors on breast cancer development and progression.	World journal of experimental medicine	2025 Sep 20	['Ozer SP', 'Keyif F', 'Bolat F', 'Ozer B', 'Aktas G']	41523761
Pembrolizumab-Induced Colitis With Concurrent Capecitabine in Triple-Negative Breast Carcinoma: A Case Report.	Immune checkpoint inhibitors (ICIs) have revolutionized cancer treatment, but their use is associated with immune-related adverse events (irAEs). Colitis is a significant irAE, particularly with programmed cell death protein 1 (PD-1) inhibitors like pembrolizumab. This case report details a 48-year-old female with triple-negative breast cancer (TNBC) who developed colitis while on pembrolizumab and capecitabine. The patient presented with symptoms including diarrhea and stomatitis, which were initially managed with supportive care. Subsequent investigation with colonoscopy was normal appearing; however, biopsy revealed mild focal active colitis microscopically. This case highlights the importance of early recognition and management of pembrolizumab-induced colitis, especially in patients receiving concurrent chemotherapy, and emphasizes the need to differentiate it from other gastrointestinal issues or other drug-induced colitis, such as that caused by capecitabine. This case also adds evidence to help guide early histological identification of ICI-induced colitis, and a comprehensive literature review on pembrolizumab-induced colitis is presented, discussing its incidence, clinical presentation, diagnosis, and management strategies.	Cureus	2026 Jan	['Kafka W', 'Frandah W', 'Diks J']	41523718
BAF-UNet: a boundary-aware segmentation model for skin lesion segmentation.	PURPOSE: Skin lesion segmentation plays a significant role in the diagnosis and treatment of skin cancer. Accurate skin lesion segmentation is essential for skin cancer diagnosis and treatment but is challenged by ambiguous boundaries and diverse lesion shapes and sizes. We aim to improve segmentation performance with enhanced boundary preservation. APPROACH: We propose BAF-UNet, a boundary-aware segmentation network. It integrates a multiscale boundary-aware feature fusion (BFF) module to combine low-level boundary features with high-level semantic information, and a boundary-aware vision transformer (BAViT) that incorporates boundary guidance into MobileViT to capture local and global context. A boundary-focused loss function is also introduced to prioritize edge accuracy during training. The model is evaluated on ISIC2016, ISIC2017, and PH2 datasets. RESULTS: Experiments demonstrate that BAF-UNet improves Dice scores and boundary accuracy compared to baseline models. The BFF and BAViT modules enhance boundary delineation while maintaining robustness across lesions of varying shapes and sizes. CONCLUSIONS: BAF-UNet effectively integrates boundary guidance into feature fusion and transformer-based context modeling, significantly improving segmentation accuracy, particularly along lesion edges, and shows potential for clinical application in automated skin cancer diagnosis.	Journal of medical imaging (Bellingham, Wash.)	2026 Jan	['Zhang M', 'Zhang C', 'Quan Z', 'Guo B', 'Yang W']	41523667
Current Treatment Strategies for Diffuse Tenosynovial Giant Cell Tumor: A Review of the Literature.	BACKGROUND: Diffuse tenosynovial giant cell tumor (DTGCT) is a locally aggressive benign tumor of the synovium. Patients often initially present with pain, stiffness, and swelling of the affected joint with varying levels of severity. Treatment traditionally involved surgical resection exclusively; however, this could be complicated by high disease recurrence rates. New research has introduced several targeted systemic therapies onto the market changing the treatment paradigm and necessitating a multidisciplinary treatment approach in specialized centers to optimize patient outcomes. METHODS: This review synthesizes the current literature on DTGCT including its pathophysiology, classification, diagnosis, and available treatment options. There is a particular focus on the newer systemic therapies available and how these medications may be used in conjunction with surgery to enhance disease control. RESULTS: DTGCT most commonly affects young to middle-aged adults, with a slight female predominance, and is most frequently found in the knee. Arthroscopic and even open synovectomy can have disease recurrence rates exceeding 50%. Colony stimulating factor 1 (CSF1) receptor inhibitors have proven effective at symptom palliation and reducing tumor burden in approximately 40% of patients. While these medications improve the quality of life for patients with unresectable disease, they may also be effective in the neoadjuvant setting to downstage surgical approaches and possibly improve disease control in otherwise highly morbid cases. CONCLUSIONS: Surgery alone, the traditional standard for DTGCT, is often insufficient due to high recurrence rates. Systemic therapies can restore function and improve quality of life in patients with advanced disease with rare-but potentially serious-adverse effects. Combining surgical resection with neoadjuvant CSF1R inhibition may provide superior outcomes. Further research is needed to refine the role of systemic agents and develop multidisciplinary protocols. Although initial symptoms often lead patients to community providers, optimal care for patients with DTGCT is best delivered at referral centers with dedicated musculoskeletal oncology programs. LEVEL OF EVIDENCE: Level V. See Instructions for Authors for a complete description of levels of evidence.	JB & JS open access	2026 Jan-Mar	['Mosher H', 'Dean K', 'Meli G', 'Desrosiers J', 'Crawford B', 'Temple HT', 'Hornicek FJ', 'Rosenberg AE', 'Jonczak E', 'Palmerini E', 'Geiger EJ']	41523664
Beyond synthetic lethality in large-scale metabolic and regulatory network models via genetic minimal intervention set.	MOTIVATION: The integration of genome-scale metabolic and regulatory networks has received significant interest in cancer systems biology. However, the identification of lethal genetic interventions in these integrated models remains challenging due to the combinatorial explosion of potential solutions. To address this, we developed the genetic Minimal Cut Set (gMCS) framework, which computes synthetic lethal interactions-minimal sets of gene knockouts that are lethal for cellular proliferation- in genome-scale metabolic networks with signed directed acyclic regulatory pathways. Here, we present a novel formulation to calculate genetic Minimal Intervention Sets, gMISs, which incorporate both gene knockouts and knock-ins. RESULTS: With our gMIS approach, we assessed the landscape of lethal genetic interactions in human cells, capturing interventions beyond synthetic lethality, including synthetic dosage lethality and tumor suppressor gene complexes. We applied the concept of synthetic dosage lethality to predict essential genes in cancer and demonstrated a significant increase in sensitivity when compared to large-scale gene knockout screen data. We also analyzed tumor suppressors in cancer cell lines and identified lethal gene knock-in strategies. Finally, we demonstrate how gMISs can help uncover potential therapeutic targets, providing examples in hematological malignancies. AVAILABILITY AND IMPLEMENTATION: The gMCSpy Python package now includes gMIS functionalities. Access: https://github.com/PlanesLab/gMCSpy.	Bioinformatics advances	2026	['Barrena N', 'Rodriguez-Flores C', 'Valcarcel LV', 'Olaverri-Mendizabal D', 'Agirre X', 'Prosper F', 'Planes FJ']	41523653
Transient expression of human interleukin-15 in Nicotiana benthamiana.	A plant-based expression system provides a cost-effective, scalable, and safe alternative to traditional cell culture platforms. In this study, recombinant human interleukin-15 (IL-15) was transiently expressed in Nicotiana benthamiana plants using agroinfiltration. IL-15 is a cytokine with significant potential in cell engineering, immunotherapy, and cancer therapy. A codon-optimized IL-15 gene was cloned into a binary vector designed for plant expression and introduced into Rhizobium radiobacter (formerly Agrobacterium tumefaciens). The R. radiobacter for human IL-15 expression was infiltrated into N. benthamiana leaves. Following purification, receptor-binding assays confirmed that the plant-derived IL-15 could bind to the IL-15 receptor comparably to its mammalian-produced counterpart. This first report of IL-15 expression in plants highlights the promise of plant-based systems for biopharmaceutical production and lays the groundwork for further development of IL-15 for applications in cell engineering, clinical therapies, and the cultured meat industry.	Plant biotechnology (Tokyo, Japan)	2025 Dec 25	['Mukai Y', 'Taguchi Y', 'Matsuo K']	41523590
Short- and Long-term Outcomes After Laparoscopic Versus Open Total Gastrectomy for Advanced Gastric Cancer.	BACKGROUND/AIM: Total gastrectomy is the cornerstone treatment for gastric cancer, particularly in patients with proximal or large tumors. For early-stage gastric cancer, laparoscopic total gastrectomy (LTG) has demonstrated comparable short- and long-term outcomes to those of open total gastrectomy (OTG), while reports on advanced gastric cancer (AGC) are limited. We aimed to compare the short- and long-term outcomes of patients with AGC who underwent LTG or OTG. PATIENTS AND METHODS: This study included consecutive patients with AGC who underwent LTG or OTG with lymph node dissection at our institution from January 2002 to June 2024. Propensity score matching was conducted at a 1:1 ratio to reduce bias. RESULTS: A total of 158 patients were enrolled (LTG: 39; OTG: 119). Of these, 64 were paired by propensity score matching. The clinical tumor invasion depth was balanced, but the pathological depth was significantly deeper in the LTG group. The number of patients with lymph node metastasis did not differ. The median operative time was longer for LTG (512.5 min) than for OTG (267 min), whereas LTG resulted in significantly less blood loss (125 g vs. 411 g). Postoperative morbidity (>/=ClavienDindo grade 3) was comparable (LTG: 12.5%, OTG: 9.4%). The LTG group had a significantly shorter median hospital stay (11 days vs. 17 days). There were no significant differences in overall or recurrence-free survival between the groups. CONCLUSION: LTG is a feasible and safe approach for AGC, offering comparable short- and long-term outcomes to OTG.	Cancer diagnosis & prognosis	2026 Jan-Feb	['Kawaguchi Y', 'Shoda K', 'Maruyama S', 'Saito R', 'Izumo W', 'Takiguchi K', 'Shiraishi K', 'Furuya S', 'Amemiya H', 'Kawaida H', 'Ichikawa D']	41523584
Robot-Assisted Sigmoidectomy in a Patient With Situs Inversus Totalis: A Case Report.	Situs inversus totalis (SIT) is a rare congenital anomaly characterized by a complete mirror-image transposition of thoracic and abdominal organs. Surgery in such patients is technically challenging because of the reversed anatomy, and only a few cases of robot-assisted surgery (RS) for colon cancer in SIT have been reported. We report a rare case of robot-assisted sigmoidectomy with radical lymph node dissection for sigmoid colon cancer in a 31-year-old woman with SIT. The patient presented with abdominal pain and hematochezia, and was diagnosed with sigmoid colon cancer at a previous hospital. Further examination at our institution confirmed SIT, and a robot-assisted sigmoidectomy was successfully performed with modified port placement to accommodate the mirrored anatomy. The procedure was completed safely, and the patient was discharged without complications. RS can be a safe and effective approach for patients with anatomical anomalies such as SIT.	Cureus	2025 Dec	['Nagakari K', 'Shibasaki H', 'Sahara Y', 'Igata Y']	41523576
Pulmonary Hypertension in Rare Disease Overlap: Neurofibromatosis Type 1 Meets Sarcoidosis.	We present a case of pulmonary hypertension (PH) and right heart failure in a 66-year-old female patient with longstanding neurofibromatosis Type I (NF1) since 1973 and sarcoidosis since 2009. She had a history of breast cancer 30 years ago, which was treated with left mastectomy followed by chemotherapy, and she has remained in remission thereafter. We detail her clinical presentation, diagnostic evaluation, and therapeutic course, highlighting the diagnostic challenges posed by multifactorial PH and the implications for targeted management.	Cureus	2025 Dec	['Sharma A', 'Bilal Y', 'Yousaf I', 'Masuta P', 'Gupta D']	41523545
Radiation-Induced Breast Sarcoma: A Case Report and Review of the Literature.	Radiation-induced sarcoma (RIS) of the breast is a rare but serious late complication of radiotherapy, characterized by high-grade malignancy, rapid recurrence, and poor prognosis. Although rare, its incidence may increase due to improved survival rates among breast cancer patients. We report the case of a 56-year-old woman who developed a pleomorphic undifferentiated sarcoma in the irradiated field seven years after adjuvant radiotherapy for breast cancer. This case highlights the diagnostic challenges, therapeutic considerations, and prognostic implications of this rare entity.	Cureus	2025 Dec	['Bahida K', 'Zouiten O', 'Afani L', 'El Fadli M', 'Belbaraka R']	41523525
Histoblast: A Novel Cavitative High-Intensity Focused Ultrasound (HIFU)-Modified Technique for Benign Prostatic Hyperplasia.	Benign prostatic hyperplasia (BPH) is a prevalent condition, often requiring intervention due to its impact on quality of life. High-intensity focused ultrasound (HIFU) has demonstrated efficacy in prostate cancer treatment; however, its application in BPH remains limited by prolonged treatment times and delayed symptom relief. This report introduces a novel HIFU-based technique (Histoblast) using the Sonablate 500(R) (SB-500) system to improve treatment efficiency and clinical outcomes in BPH. Key modifications to the conventional HIFU approach include: (1) a checkerboard treatment pattern to reduce treatment time (TT) and tissue edema; (2) prostate compression via increased degassed water volume to minimize heat dissipation and enhance acoustic efficiency; and (3) optimized energy delivery within the upper third of the device's approved range. Treatment progress is monitored using standard safety parameters, including Tissue Change Monitoring and Reflectivity Index measurements. The procedure is performed under spinal anesthesia, with postoperative catheterization lasting approximately four days. This technique reduces the number of treatment shots by 40-50%, achieving a significantly shorter TT. Controlled acoustic cavitation is observed in up to 70-75% of treated zones, indicating effective tissue ablation. Preservation of the urethra and bladder neck is prioritized to facilitate early catheter removal. This technique represents a promising refinement of HIFU for BPH management and warrants further clinical evaluation.	Cureus	2025 Dec	['Garcia-Gutierrez CM', 'Garcia-Becerra CA', 'Garcia-Becerra N', 'Becerra-Herrejon H', 'Shoji S', 'Sanghvi NT']	41523515
A Rare Case of Parathyroid Carcinoma Initially Misdiagnosed as a Parathyroid Adenoma.	Parathyroid carcinoma is an uncommon endocrine malignancy that can resemble a benign parathyroid adenoma, typically presenting with hypercalcaemia and nonspecific symptoms that make preoperative diagnosis difficult. We report the case of a 38-year-old woman from Birmingham, United Kingdom, who presented with recurrent hypercalcaemia associated with body aches, lethargy, polydipsia, and voice changes. Initial laboratory tests revealed elevated calcium and elevated parathyroid hormone levels. Imaging studies identified a small left parathyroid lesion consistent with a functioning adenoma. The patient underwent left superior parathyroidectomy, with postoperative normalization of calcium and parathyroid hormone levels. Histopathological examination unexpectedly revealed parathyroid carcinoma, confirmed by parafibromin immunohistochemistry and review by a second pathologist. Postoperative imaging showed no evidence of metastasis, and the patient remains asymptomatic with normal biochemical values during follow-up. This case highlights the diagnostic challenge of distinguishing parathyroid carcinoma from adenoma and emphasizes the importance of histopathological evaluation and multidisciplinary management.	Cureus	2025 Dec	['Khan JA', 'Ahmad N']	41523514
Hysteroscopic Diagnosis of a Concurrent Placental Site Nodule and Cervical Adenocarcinoma: A Case Report.	A 32-year-old woman presented with atypical glandular cells on cervical cytology. Her obstetric history was gravida 2 para 2, with 23 months since her last pregnancy. Colposcopy and biopsy revealed cervical adenocarcinoma. Magnetic resonance imaging and positron emission tomography/computed tomography showed no distant spread but suggested a uterine lesion, which was suspected to be corpus uterine cancer. Hysteroscopy revealed a 15-mm white nodular lesion in the lower uterine body; biopsy suggested a placental site nodule (PSN). Cervical conization confirmed stage IA2 cervical adenocarcinoma. The patient underwent a radical hysterectomy. Final pathology showed no residual carcinoma. The uterine lesion was confirmed as benign PSN via immunohistochemistry. She remained recurrence-free at the two-year follow-up. This is the first reported case of concurrent PSN and cervical adenocarcinoma. Visualization and targeted biopsy allowed accurate diagnosis of PSN, preventing overtreatment. The case highlights the diagnostic value of hysteroscopy and the importance of histological evaluation to differentiate PSN from malignancy.	Cureus	2025 Dec	['Yamazoe M', 'Tarumi Y', 'Yamamoto S', 'Fujiwara Y', 'Mori T', 'Koshiba A']	41523511
Hippocampal Atrophy Following Therapeutic Irradiation of Intracranial and Nasopharyngeal Tumors.	The review aims to summarize and evaluate existing data on macroscopic changes in hippocampal volume following therapeutic brain irradiation, with a focus on the patterns, dynamics, and modulating factors of this structural damage. This narrative review is based on a structured search of the PubMed/Medical Literature Analysis and Retrieval System Online (MEDLINE) database and relevant bibliographies (2000-2025), selecting studies that applied MRI volumetry to assess hippocampal changes after radiotherapy. We summarized the results of studies using MRI volumetry in patients undergoing radiation therapy for central nervous system tumors and nasopharyngeal cancer. The analysis covered various irradiation methods, including local and whole-brain techniques, with a focus on dose-volume relationships, temporal dynamics, and differential vulnerability of subfields. The data indicate a marked, dose-dependent reduction in hippocampal volume following irradiation. The degree of atrophy, often reaching 5-9% in the early years, significantly exceeds normal age-related decline and may rival that seen in neurodegenerative pathologies. Certain subregions, particularly the dentate gyrus and CA1, show particular sensitivity. The temporal development of atrophy varies, showing both rapid initial loss followed by stabilization and progressive patterns. The pediatric population may show partial recovery of the growth trajectory, albeit with a reduced baseline. Critical factors influencing the degree of atrophy include patient age and, potentially, neoadjuvant chemotherapy, while concurrent chemotherapy is often not a determining factor. Quantitative assessment of hippocampal volume change is a reliable and objective biomarker of radiation-induced neurotoxicity. This parameter is an important tool for refining hippocampal radiation dose constraints in radiation therapy planning and for functional assessment after treatment, highlighting the need to incorporate hippocampal protection strategies into modern neuro-oncology practice.	Cureus	2025 Dec	['Galkin MV', 'Golanov AV', 'Antipina N']	41523490
