Title	Abstract	Journal	Date of Publication	Authors	PMID
Impact of county financial assistance on cancer treatment and survival among uninsured patients.	BACKGROUND: Texas has the largest uninsured population in the country. To cover medical costs of uninsured patients, multiple counties offer Financial Assistance Programs (FAPs). The association of these programs with access to cancer treatment and survival has not been studied. METHODS: Population-based Texas Cancer Registry was used to include uninsured patients aged 18 to 64 years and diagnosed with liver, lung, or pancreatic cancer from 2017 to 2021. County FAP status was ascertained from official county or county hospital websites. Multivariable binary logistic regression analyses were used to determine the adjusted odds of receipt of any cancer treatment (surgery, chemotherapy, or radiation). Subsample analyses were performed for patients with non-metastatic cancer and residents of metropolitan areas. Multivariable Cox Proportional Hazards analyses were used for survival analysis. RESULTS: Among 5,477 uninsured patients, 47.7% were reported to have received cancer treatment. On multivariable analysis, living in a county that offered (vs. did not offer) FAPs was associated with 1.49 higher odds of receiving cancer treatment (95%CI: 1.28-1.73). Survival analysis indicated that the Hazards of death were 44% to 55% lower for patients who received cancer treatment and lived in FAP counties (vs. did not receive cancer treatment and did not live in FAP Counties). RELEVANCE: For uninsured patients with cancer, residence in a county that offers financial assistance was associated with significantly increased odds of receiving treatment and significantly lower hazards of death. These findings provide evidence for policy interventions that may improve cancer care and outcomes for uninsured patients.	JNCI cancer spectrum	2026 Jan 9	['Khan MS', 'Leonard T', 'Etingen B', 'Williams N', 'Zeh HJ 3rd', 'Polanco PM']	41524134
An Injectable Hydrogel with Stepwise Drug Release for Chemo-Photothermal Therapy of Tumors.	Traditional chemotherapy drugs are not sustainably released and need to be administered multiple times, often leading to drug resistance and systemic toxicity. In this work, we designed a novel injectable hydrogel, made of chitosan and beta-glycerophosphate, to codeliver chemotherapeutic drug mitoxantrone (MTO) and MTO-loaded PEGylated black phosphorus quantum dots (BP-PEG-MTO/MTO@Gel) for chemo-photothermal therapy of tumors with stepwise drug release. The hydrogel with a three-dimensional porous structure significantly enhanced drug loading and enabled a staged release of MTO. First, a large amount of MTO was released from the hydrogel, and BP-based photothermal therapy (PTT) can cause rapid ablation of local tumors. Second, the sustained release of MTO from BP has a long-term inhibitory effect against tumor growth. In vitro and in vivo evaluations confirmed that BP-PEG-MTO/MTO@Gel in the presence of PTT significantly enhanced the cytotoxic effect on tumor cells and inhibited tumor growth. The strategy uses an injectable hydrogel to combine chemotherapy and PTT with stepwise drug release on local tumors, showing a promising pathway for cancer therapy.	Langmuir : the ACS journal of surfaces and colloids	2026 Jan 12	['Chen R', 'Liang X', 'Wu G', 'Lin X', 'Zhu H', 'Li X', 'Zhou B']	41524092
Information Needs and Preferences of Men With Breast Cancer: A Qualitative Analysis of Internet Forum Posts.	"BACKGROUND AND AIMS: Sex-/gender-specific health information for men with breast cancer is lacking. Health information supports patients in shared decision-making. When developing evidence-based health information, it is important to identify the patients' information needs and preferences with regard to age, sex or gender, and other diversity aspects, including how the content is provided for the target group. However, studies show that sex/gender differences have rarely been considered. Our study investigates the information needs and preferences of cisgender men with breast cancer. METHODS: A content-structuring, qualitative content analysis of forum posts was performed. Internet forums and posts were selected according to the following criteria: relevance of the topic, English or German language, and public availability without registration. A qualitative content analysis according to Kuckartz was conducted. The selected posts were coded using MAXQDA. RESULTS: A total of 1025 posts from three Internet forums were screened, and 96 posts were included for analysis-most of them from a German Internet forum. We identified seven main categories and 26 subcategories. Information needs and preferences are represented by the following main categories: ""Epidemiology and general questions about the disease,"" ""Diagnostics,"" ""Therapy,"" ""Physician specialist services,"" ""Rehabilitation and lifestyle adaption,"" and ""Mental health."" Additionally, the ""Preference for and access to current information"" plays a role for the patients. CONCLUSIONS: Our study provides new insights into the information needs and preferences of men with breast cancer, mainly from German-speaking countries. Providing accurate and reliable health information that meets patients' needs and preferences is an ethical duty and has to be provided by healthcare systems. Such patient-centered and inclusive health care will empower patients to make informed decisions."	The breast journal	2026	['Schemmel N', 'Lauberger J', 'Luhnen J', 'Steckelberg A']	41524023
The Effectiveness of Mindfulness-Based Interventions for Depressive Symptoms and Their Relationship to Interoceptive Awareness: A Systematic Review.	BACKGROUND: This systematic review aimed to investigate the effectiveness of mindfulness-based interventions (MBIs) in treating depression, enhancing interoceptive awareness (IA), and whether IA mediates this relationship. METHODS: In August 2024, a comprehensive literature search was conducted in web-based medical and psychological databases, including PsycINFO, MEDLINE, and Scopus, following the Preferred Reporting Items for Systematic Reviews and Meta-Analyses guidelines. Studies were included if they were quantitative, peer-reviewed, in English, used MBIs derived from Mindfulness-based Stress Reduction (MBSR), Mindfulness-based Cognitive Therapy (MBCT), or Mindfulness-integrated Cognitive Behavioural Therapy (MiCBT), included a control/comparison group, pre- and post-intervention measures, assessed depressive symptoms and IA in adults over 18, and had at least 20 participants. Exclusion criteria included non-English publications, dissertations, case studies, qualitative research, therapies not derived from the specified MBIs, and studies with under 20 participants or individuals under 18. Methodological quality and risk of bias were assessed. RESULTS: Six studies involving 646 participants met the inclusion criteria. All MBIs (MBCT, MBSR, MiCBT, Mindfulness-based Cancer Recovery, and Mindful Awareness in Body-Oriented Therapy) significantly reduced depressive symptomology and improved IA across varying effect sizes, with IA identified as a partial mediator. CONCLUSIONS: MBIs appear to alleviate depressive symptoms and improve IA, with one study finding IA as a mediator. Limitations included limited literature, search term specificity, heterogeneity and mixed evidence quality. Future research should explore IA's mediating role, develop a standardised IA measure, and integrate IA into broader treatment modalities to enhance outcomes. THE PROSPERO REGISTRATION: CRD42023457300, https://www.crd.york.ac.uk/PROSPERO/view/CRD42023457300.	Alpha psychiatry	2025 Dec	['Knep S', 'Shires A']	41523976
Survivorship Issues in Older Adults with Breast Cancer.	PURPOSE OF REVIEW: The number of older adult breast cancer survivors is increasing. This growing demographic comprises both women diagnosed with breast cancer when they are 65 years or older as well as women diagnosed in younger adulthood who then survive to elderhood. Older adult breast cancer survivors face unique challenges, including possible increased baseline comorbidity, symptom burden and a greater propensity to experience functional and cognitive decline after treatment. RECENT FINDINGS: This review outlines survivorship concerns affecting older adults with a history of breast cancer, including osteoporosis, increased risks of hip fractures, and worsened survival associated with the development of comorbidity. The review also acknowledges the existing interventions to identify and mitigate survivorship concerns of older adults including comprehensive geriatric assessments. SUMMARY: Highlighting the unique needs of this population may better inform treatment decision-making at the time of diagnosis and identify opportunities for future investigation in this realm.	Current breast cancer reports	2025 Dec	['Morton CR', 'Lorentzen EH', 'Minami CA']	41523952
Perineal Verrucous Carcinoma Associated With Hypercalcemia: First Clinical Report of Parathyroid Hormone-Related Protein-producing Tumor.	Cancer-related hypercalcemia typically indicates poor prognosis and occurs most commonly in squamous cell carcinoma cases. However, its occurrence in patients with verrucous carcinoma, a clinically indolent subtype, has never been reported. We present the first documented case of verrucous carcinoma-related hypercalcemia caused by parathyroid hormone-related protein (PTHrP) production. A 49-year-old man presented with weight loss, fatigue, and severe hypercalcemia. He had a 3-year history of a scrotal mass that was diagnosed as perineal verrucous carcinoma based on histopathologic examination. Laboratory results revealed markedly elevated calcium (13.0 mg/dL) and PTHrP (6.6 pmol/L) levels, confirming tumor-associated hypercalcemia. The cauliflower-like tumor measuring 17 x 15 cm involved the penis and scrotum. Complete surgical resection with bilateral inguinal lymph node dissection was performed. Split-thickness skin grafts provided wound coverage over the large perineal defect. Immunohistochemical staining confirmed PTHrP production by tumor cells that had invaded beyond the basement membrane. Postoperative calcium (9.8 mg/dL) and PTHrP (<1.1 pmol/L) levels normalized rapidly. Histopathology confirmed verrucous carcinoma with dermal invasion; however, no lymph node metastasis occurred. Pseudomonas aeruginosa infection developed but resolved with topical treatment. Six-month follow-up magnetic resonance imaging showed no recurrence with sustained hypercalcemia resolution. This first documented case linking PTHrP-mediated hypercalcemia to verrucous carcinoma demonstrates that paraneoplastic hypercalcemia can occur in this typically indolent malignancy when dermal invasion occurs. Recognition of this rare syndrome is crucial for optimal management. Complete surgical excision achieved both oncological control and resolution of systemic complications, highlighting the importance of aggressive treatment when basement membrane invasion is present.	Plastic and reconstructive surgery. Global open	2026 Jan	['Oka W', 'Kuwahara H', 'Motoda N', 'Ishikawa M', 'Ogawa R', 'Akaishi S']	41523918
Integrated Multiomics Analysis Reveals a Migrasome-Related Signature for Prognosis and Immunotherapy Response in Lung Adenocarcinoma.	"BACKGROUND: Migrasomes, a newly identified subtype of extracellular vesicles generated during cell migration, play crucial roles in tumor microenvironment modulation. However, their systematic characterization in lung adenocarcinoma (LUAD) remains unexplored. This study is aimed at deciphering migrasome-related molecular features and their clinical significance through multiomics integration. METHODS: We integrated bulk transcriptomes (541 LUAD samples from TCGA/GEO) with single-cell RNA-seq (GSE156632). Migrasome-related genes (MIGgenes) were identified through WGCNA and differential expression analysis. A machine learning framework incorporating 10 algorithms generated 101 combinatorial models, with the optimal prognostic signature (MIGsig) selected via 10-fold cross-validation. Biological mechanisms were investigated through ssGSEA, TME analysis, and in vitro validation. RESULTS: Our analysis revealed significant migrasome activity enrichment in endothelial cells and fibroblasts, with 115 cross-omics MIGgenes identified including 31 prognostic markers. The Lasso-Cox-derived 3-gene signature (GSTM5/DNASE1L3/PDGFB) demonstrated robust predictive performance (training set C index = 0.703; validation set GSE50081 AUC = 0.678). The low-MIGsig group exhibited characteristic ""hot tumor"" features, including elevated immune infiltration and higher tumor mutational burden, and significantly improved immunotherapy response rates in the IMvigor210 cohort. Finally, MIGsig-related genes were further validated by in vitro experiments and public database. CONCLUSIONS: This study establishes the first migrasome-based prognostic model for LUAD, demonstrating both independent survival prediction capability and clinical utility for identifying immunotherapy beneficiaries. The MIGsig signature provides novel biological insights into migrasome-mediated tumor-immune interactions and represents a promising tool for precision oncology applications in LUAD management."	Human mutation	2026	['Zhou J', 'Song T', 'Wang N', 'Liang C', 'Jiang M', 'Zhang X', 'Gao H', 'Feng Q', 'Nair S']	41523912
Itaconate-Related Gene Signatures as Prognostic Markers in Colon Cancer: Insights From Transcriptomic and Spatial Analysis.	Colon cancer is one of the most prevalent malignant tumors. Accurate evaluation of patient prognosis and optimization of treatment strategies continue to be major research focuses in colon cancer. Based on The Cancer Genome Atlas (TCGA) database, this study is the first to comprehensively analyze the expression, biological roles, and prognosis of itaconate and Hallmark pathway-related genes in colon cancer using bulk transcriptomics, single-cell transcriptomics, and spatial transcriptomics data. Through strict screening in 448 colon cancer patients from TCGA database (training set) and 7 colon cancer prognostic models from the Gene Expression Omnibus (GEO) database (including 1473 cases in the validation set), 10 prognosis-related genes (TIMP1, FJX1, CD36, CXCL1, ETS2, CDKN2A, INHBB, PLEC, TUBB2, and P4HA1) were selected. The optimal prognostic prediction model (Enet [alpha = 0.2]) was constructed and validated, which showed good prognostic predictive value in both the training and validation sets (average C-index > 0.7) and was superior to previous conventional clinical features and 22 prognostic models developed by researchers in the past 4 years. ScRNAseq (GSE225857) and spatial transcriptomics analyses clarified the cell-specific expression and spatial distribution characteristics of these genes in the tumor microenvironment (TME), with high functional scores mainly enriched in epithelial and stromal cells. Tissue microarray (TMA) showed that the high-risk group had higher tumor mutation burden (TMB) and higher expression of immune checkpoint genes, suggesting higher sensitivity to immunotherapy. Drug sensitivity analysis identified four potentially effective drugs, such as sepantronium bromide, which had better effects on high-risk patients. This study provides a theoretical basis and new targets for precise prognosis and stratified treatment of colon cancer.	Human mutation	2026	['Zhang T', 'Meng J', 'Wang Q', 'Zhang P', 'Li H', 'Wei H', 'Chen D', 'Bai C', 'Nair S']	41523911
De-escalation of axillary surgery after neoadjuvant therapy in breast cancer: long-term outcomes of sentinel lymph node biopsy alone versus complete axillary lymph node dissection.	BACKGROUND: The optimal management of axillary lymph nodes after neoadjuvant systemic therapy (NST) in breast cancer remains controversial. The oncological outcomes of sentinel lymph node biopsy (SLNB) alone compared with axillary lymph node dissection (ALND) after NST are not well established. OBJECTIVE: This study comprehensively evaluated the long-term outcomes of SLNB alone versus ALND following NST in breast cancer patients achieving ycN0 status. DESIGN: A retrospective, multicenter, real-world study. METHODS: Patients initially presenting with clinically node-negative (cN0) or clinically node-positive (cN+) breast cancer who remained or converted to ycN0 after NST (2011-2022) were included. Patients were divided into SLNB-alone and ALND groups. Primary endpoints were disease-free survival (DFS) and overall survival (OS). Secondary endpoints included recurrence rates, local recurrence-free survival (LRFS), regional recurrence-free survival (RRFS), and distant metastasis-free survival (DMFS). Inverse probability of treatment weighting (IPTW) was applied to balance baseline characteristics. RESULTS: A total of 1381 patients were included: 461 received SLNB alone, and 920 underwent ALND. Median follow-up was 34.2 months (range: 1.2-142.6 months). Local (2.8% vs 3.3%, p = 0.656) and regional (2.0% vs 1.3%, p = 0.353) recurrence rates were comparable between SLNB and ALND groups; distant metastases occurred in 5.6% versus 8.5% (p = 0.059). No significant differences in DFS, OS, LRFS, RRFS, or DMFS were observed between the SLNB-alone and ALND groups after IPTW adjustment. Subgroup analyses confirmed similar DFS or OS between the two surgical approaches across initial cN0 and cN+ subgroups; however, patients with initial cN2-3 disease exhibited inferior LRFS with SLNB alone. CONCLUSION: SLNB alone achieves oncologic outcomes comparable to ALND in ycN0 breast cancer patients after NST, regardless of initial nodal status, with caution warranted in initial cN2-3 disease. This suggests that SLNB alone can safely substitute ALND without compromising oncologic outcomes in appropriately selected patients.	Therapeutic advances in medical oncology	2026	['Chen H', 'Qian X', 'Mao L', 'Tao Y', 'Yang Y', 'Gui X', 'Liu Q', 'Yao H']	41523910
Nephrotoxicity secondary to CDK 4/6 inhibitors in advanced breast cancer patients and its impact on survival.	BACKGROUND: Cyclin-dependent kinase 4/6 (CDK4/6) inhibitors have become a cornerstone in the treatment of HR+/HER2- advanced breast cancer. While their efficacy is well-established, emerging reports of nephrotoxicity warrant further investigation into its incidence, risk factors, and potential impact on survival outcomes. OBJECTIVES: This study aimed to evaluate the incidence and risk factors for nephrotoxicity in patients receiving CDK4/6 inhibitors (palbociclib or ribociclib) and to analyze its association with progression-free survival (PFS) and overall survival (OS). DESIGN: This was a single-center, retrospective cohort study. METHODS: We reviewed the medical records of 120 patients with advanced breast cancer treated with palbociclib or ribociclib between October 2018 and July 2024. Nephrotoxicity was defined as a 20% decline in creatinine clearance (CKD-EPI 2021) from baseline. Statistical analyses included descriptive statistics, chi-square tests, t-tests, Kaplan-Meier survival analysis, and Cox regression models. RESULTS: Nephrotoxicity occurred in 28 patients (23.3%). Older age (65 years) and higher baseline urea and creatinine levels were significant risk factors (p < 0.001). Paradoxically, patients who developed nephrotoxicity showed a trend toward better survival outcomes: median PFS was 30 months versus 20 months (p = 0.188), and the 3-year OS rate was 77.9% versus 63.8% (p = 0.801), though these differences were not statistically significant. In multivariate Cox analysis, the development of nephrotoxicity showed a trend toward a 71% reduction in mortality risk (HR = 0.293, p = 0.078), but it was not statistically significant. CONCLUSION: Nephrotoxicity is relatively common in patients treated with CDK4/6 inhibitors, particularly in older individuals and those with elevated baseline renal parameters. Contrary to conventional expectations, its occurrence may be associated with a trend toward improved survival, possibly reflecting higher drug exposure or effective target inhibition. These findings highlight the need for careful renal monitoring and suggest that nephrotoxicity could serve as a potential surrogate marker for treatment efficacy, warranting validation in larger prospective studies.	Therapeutic advances in medical oncology	2026	['Avci T', 'Altunbas AA', 'Sahbazlar M', 'Ekinci F', 'Erdogan AP']	41523909
Cancer-derived inflammation is associated with bevacizumab resistance and inferior clinical outcomes in patients with metastatic colorectal cancer.	BACKGROUND: Cancer-derived inflammation has been shown to attenuate the efficacy of chemotherapy (CT) in colorectal cancer. However, its role in clinical response to bevacizumab (Bev) remains unclear in patients with metastatic colorectal cancer (mCRC). OBJECTIVES: To investigate the clinical significance of the fibrinogen-to-prealbumin ratio (FPR) as a biomarker in mCRC patients receiving first-line Bev plus CT (Bev/CT). DESIGN: A retrospective, single-center, observational study. METHODS: Patients treated with first-line Bev/CT were enrolled across discovery (n = 249), internal validation (n = 115), and external validation (n = 109) cohorts, along with a patient group receiving CT alone (n = 175). Propensity score matching was performed to balance baseline characteristics between the Bev/CT- and CT-treated groups. The primary endpoints were disease control rate (DCR) and progression-free survival (PFS), and 1-year overall survival (OS) was designated as a secondary endpoint. RESULTS: Elevated pretreatment FPR was significantly associated with increased tumor burden. FPR-H patients exhibited an unfavorable DCR compared to the FPR-L patients in the overall Bev/CT-treated population (adjusted odds ratio (OR) = 2.18, 95% confidence interval (CI) = 1.32-3.61, p < 0.01). FPR-H was also independently associated with shorter PFS in the discovery (p (log-rank) < 0.01, adjusted hazard ratio (HR) = 1.51, 95% CI = 1.11-2.05), internal validation (p (log-rank) < 0.01, adjusted HR = 2.47, 95% CI = 1.43-4.27), and external validation cohorts (p (log-rank) < 0.001, adjusted HR = 2.28, 95% CI = 1.43-3.64), regardless of KRAS status, particularly in the microsatellite stable subgroup. Furthermore, FPR-H patients had significantly worse 1-year OS than the FPR-L subgroup in the overall population (p (log-rank) < 0.001; adjusted HR = 2.86, 95% CI = 1.78-4.61). Dynamic monitoring of FPR demonstrated utility in tracking disease progression during Bev/CT treatment, with earlier detection capability compared to imaging-based assessment. In propensity score-matched analysis, patients receiving Bev/CT showed superior outcomes relative to those receiving CT alone (p (log-rank) < 0.001), especially among the FPR-L subgroup (p (log-rank) < 0.01). In addition, Bev/oxaliplatin-treated FPR-L cases achieved better outcomes than those receiving the Bev/irinotecan regimen, particularly in the subgroup undergoing palliative resection. CONCLUSION: Cancer-derived inflammation appears to play a crucial role in mediating both intrinsic and acquired resistance to Bev. The FPR emerges as a robust, independent biomarker for predicting response to Bev, monitoring disease progression, and informing personalized therapeutic decision-making in patients with mCRC.	Therapeutic advances in medical oncology	2026	['Li YN', 'Wu Y', 'Deng FW', 'Lu Y', 'Song GB', 'Xiang L', 'Peng T', 'Cheng XX', 'Ying HQ']	41523907
A Case Report of Non-Neutralizing Acquired Factor V Inhibitor Mimicking Deficiency: Diagnostic Challenges and Therapeutic Implications.	Acquired Factor V (FV) deficiency due to inhibitors is a rare coagulopathy that presents significant diagnostic and therapeutic challenges. We report the case of an 81-year-old male with persistent gross hematuria and severe coagulopathy, marked by prolonged prothrombin time (PT), activated partial thromboplastin time (aPTT), and critically low FV activity (< 1%). Initial mixing studies corrected the coagulation abnormalities, suggesting a deficiency rather than an inhibitor; however, standard therapies failed. Fresh frozen plasma (FFP) did not elevate FV levels, and recombinant activated Factor VII (rFVIIa) did not resolve his symptoms, raising suspicion for a non-neutralizing inhibitor that depletes FV by increasing clearance. Clinical improvement was achieved with platelet transfusions, and his FV level normalized after treatment with rituximab and intravenous immunoglobulin (IVIG). PT and aPTT improved from 60 and > 200 to 12 and 32, respectively. It has remained normal with subsequent maintenance immunosuppression with rituximab. This case illustrates the diagnostic complexity created by non-neutralizing FV inhibitors, which accelerate factor clearance without directly impairing activity. It highlights the critical need for integrating clinical and laboratory findings to guide tailored treatment in managing rare coagulopathies.	Case reports in hematology	2026	['Kalantri S', 'Pachika P', 'Balasubramanian S', 'Alquran B', 'McCoy M', 'Sharma V']	41523906
